{

  "$schema": "../schemas/governance_source_rule_crosswalk.v1.schema.json",

  "schema_version": "governance_source_rule_crosswalk.v1",

  "generated_at": "2026-05-09",

  "scope": "source_to_local_rule_traceability",

  "sources": [

    {

      "id": "workflow-governance-en",

      "title": "Workflow Governance",

      "source_type": "local_book",

      "evidence_status": "ocr_extracted_three_pass_complete",

      "formal_citation_status": "local_source_only"

    },

    {

      "id": "workflow-governance-zh-vol1",

      "title": "工作流治理 上册 第三版",

      "source_type": "local_book",

      "evidence_status": "text_layer_three_pass_complete",

      "formal_citation_status": "local_source_only"

    },

    {

      "id": "workflow-governance-zh-vol2",

      "title": "工作流治理 下册 第三版",

      "source_type": "local_book",

      "evidence_status": "text_layer_three_pass_complete",

      "formal_citation_status": "local_source_only"

    },

    {

      "id": "public-platform-harness-governance",

      "title": "一文讲透：Harness Engineering即控制论！",

      "source_type": "public_platform_article",

      "url": "https://mp.weixin.qq.com/s/_Yn-PRW2kmoOusUbTbi3vQ",

      "evidence_status": "browser_visible_and_html_rechecked_2026-05-09",

      "formal_citation_status": "not_for_formal_academic_citation"

    },

    {

      "id": "public-platform-ai-code-review-governance",

      "title": "我们让AI学习了钱学森先生的《工作流治理》，然后评审AI自己写的代码......",

      "source_type": "public_platform_article",

      "url": "https://mp.weixin.qq.com/s/9Z9rgJX9f_9Yk0mqgmo0gA",

      "evidence_status": "browser_visible_and_html_rechecked_2026-05-09",

      "formal_citation_status": "not_for_formal_academic_citation"

    },

    {

      "id": "openai-harness-engineering",

      "title": "Harness engineering: leveraging Codex in an agent-first world",

      "source_type": "official_post",

      "url": "https://openai.com/index/harness-engineering/",

      "evidence_status": "live_checked_2026-05-09",

      "formal_citation_status": "external_interpretation_only"

    },

    {

      "id": "gao-2014-workflow-governance-60-years",

      "title": "Workflow governance: 60 years in the making",

      "source_type": "peer_reviewed_article",

      "url": "https://link.springer.com/article/10.1007/s11768-014-4031-0",

      "doi": "10.1007/s11768-014-4031-0",

      "evidence_status": "live_doi_checked_2026-05-09",

      "formal_citation_status": "doi_verified"

    },

    {

      "id": "cae-qian-and-governance",

      "title": "钱学森与控制论",

      "source_type": "institutional_article",

      "url": "https://www.engineering.org.cn/sscae/CN/1160103700859511735",

      "evidence_status": "live_checked_2026-05-09",

      "formal_citation_status": "external_interpretation_only"

    },

    {

      "id": "cae-technical-science-qian",

      "title": "从钱学森的技术科学思想谈起",

      "source_type": "institutional_article",

      "url": "https://www.cae.cn/cae/html/main/col35/2018-01/04/20180104172002660835593_1.html",

      "evidence_status": "live_checked_2026-05-09",

      "formal_citation_status": "external_interpretation_only"

    }

  ],

  "principles": [

    {

      "id": "technical-science-layer",

      "name": "技术科学层",

      "source_ids": [

        "workflow-governance-zh-vol1",

        "workflow-governance-zh-vol2",

        "cae-qian-and-governance",

        "cae-technical-science-qian"

      ],

      "extracted_methodology": "把工程实践中有效的规则抽象成技术科学层，再回到工程实践中检验和修正。",

      "local_rule": "VELA 运行时的 source-of-truth 不应是聊天提示或单个工具，而应是 schema、catalog、skill、envctl 和 validator 组成的可执行中间层。",

      "local_artifacts": [

        {

          "ref": "skills/catalog/governance_kernel.json",

          "role": "control objectives and adaptation rules"

        },

        {

          "ref": "skills/scripts/envctl/",

          "role": "executable governance layer"

        },

        {

          "ref": "skills/catalog/governance_source_rule_crosswalk.json",

          "role": "source-to-rule traceability"

        }

      ],

      "verification_gates": [

        "python -m skills.scripts.envctl validate governance",

        "python -m skills.scripts.envctl validate stack"

      ],

      "implementation_status": "implemented",

      "gap_closed": "补上了工作流治理不是口号、也不是工具堆叠，而是VELA 运行时的技术科学中间层。"

    },

    {

      "id": "feedforward-constraint",

      "name": "前馈约束先于事后反馈",

      "source_ids": [

        "workflow-governance-en",

        "workflow-governance-zh-vol1",

        "public-platform-harness-governance",

        "openai-harness-engineering"

      ],

      "extracted_methodology": "控制不只靠输出后纠错，也靠提前给定结构、输入边界和执行约束。",

      "local_rule": "任务执行前必须先经过 route、profile、schema、initializer manifest、quality gate 和 dispatch contract；validator 是反馈，schema/template/route 是前馈。",

      "local_artifacts": [

        {

          "ref": "skills/catalog/routing_table.json",

          "role": "route feedforward"

        },

        {

          "ref": "skills/catalog/project_initializer_manifest.json",

          "role": "project scaffold feedforward"

        },

        {

          "ref": "skills/catalog/research_pipeline_stages.json",

          "role": "stage feedforward"

        }

      ],

      "verification_gates": [

        "validate_agents_contract",

        "validate_research_pipeline",

        "validate_vela_runtime"

      ],

      "implementation_status": "implemented",

      "gap_closed": "补足了先验约束，不再把控制论简化为事后 validator。"

    },

    {

      "id": "closed-loop-feedback",

      "name": "闭环反馈",

      "source_ids": [

        "workflow-governance-en",

        "workflow-governance-zh-vol1",

        "public-platform-harness-governance",

        "public-platform-ai-code-review-governance"

      ],

      "extracted_methodology": "输出偏差必须返回控制器，否则系统只能开环漂移。",

      "local_rule": "validator、review gate、daily audit、Zotero/Obsidian sync 和项目复盘都必须进入可记录反馈链，不能只停留在对话印象。",

      "local_artifacts": [

        {

          "ref": "skills/schemas/validator_result.schema.json",

          "role": "structured feedback envelope"

        },

        {

          "ref": "skills/catalog/evolution_backlog.json",

          "role": "feedback-to-adaptation backlog"

        },

        {

          "ref": "README.md",

          "role": "knowledge feedback loop usage boundary"

        }

      ],

      "verification_gates": [

        "python -m skills.scripts.envctl validate governance",

        "validate_research_pipeline"

      ],

      "implementation_status": "implemented",

      "gap_closed": "把反馈从抽象原则落到 validator envelope 和复盘事件。"

    },

    {

      "id": "controllability-observability-before-optimization",

      "name": "能控、能观测先于优化",

      "source_ids": [

        "workflow-governance-zh-vol1",

        "workflow-governance-zh-vol2",

        "public-platform-ai-code-review-governance",

        "gao-2014-workflow-governance-60-years"

      ],

      "extracted_methodology": "不可观测或不可控制的对象不能被可靠优化。",

      "local_rule": "不可写仓、未暴露的原生工具、未登录页面、未认证 MCP、无证据材料必须报告 blocker；不能用推测填补观测缺口。",

      "local_artifacts": [

        {

          "ref": "skills/catalog/agent_execution_modes.json",

          "role": "effective execution boundary"

        },

        {

          "ref": "skills/catalog/route_mcp_activation_policy.json",

          "role": "required and optional sensor/actuator split"

        },

        {

          "ref": "skills/plugins/research-autopilot/skills/social-platform-reader/SKILL.md",

          "role": "visible-evidence boundary"

        }

      ],

      "verification_gates": [

        "validate_agents_contract",

        "validate_vela_runtime"

      ],

      "implementation_status": "implemented",

      "gap_closed": "把能控性和能观测性从概念改成 blocker 规则。"

    },

    {

      "id": "disturbance-uncertainty-control",

      "name": "扰动与不确定性治理",

      "source_ids": [

        "workflow-governance-en",

        "workflow-governance-zh-vol2",

        "gao-2014-workflow-governance-60-years"

      ],

      "extracted_methodology": "工程系统面对随机输入、模型不完备和对象变化时，必须把不确定性纳入控制设计。",

      "local_rule": "Codex 更新、网页结构变化、OCR 噪声、路径变化、外部 GitHub 变化、MCP 可用性漂移都被视为常态扰动，由 drift check、proposal-only audit 和 rollback policy 处理。",
      "local_artifacts": [

        {

          "ref": "skills/scripts/envctl/cross_repo_drift.py",

          "role": "path and cross-repo disturbance detector"

        },

        {

          "ref": "skills/catalog/external_adoption_reviews.json",

          "role": "upstream change filter"

        },

        {

          "ref": "skills/scripts/envctl/apply_profile.py",

          "role": "profile mutation with diff, backup, rollback"

        }

      ],

      "verification_gates": [

        "python -m skills.scripts.envctl validate drift",

        "validate_vela_runtime"

      ],

      "implementation_status": "implemented",

      "gap_closed": "把不确定性提升为核心方法，而不是表格里的一条附注。"

    },

    {

      "id": "stability-latency-robustness",

      "name": "稳定性、时滞与鲁棒性",

      "source_ids": [

        "workflow-governance-en",

        "workflow-governance-zh-vol1",

        "workflow-governance-zh-vol2",

        "public-platform-ai-code-review-governance"

      ],

      "extracted_methodology": "能运行不等于稳定，反馈时滞、非线性和局部修补会造成振荡。",

      "local_rule": "自动化先 proposal-only；外部组件先 watch/adapt；用户级配置写入必须 dry-run、diff、backup、rollback；连续稳定后再推广。",

      "local_artifacts": [

        {

          "ref": "skills/catalog/governance_kernel.json",

          "role": "stability metrics"

        },

        {

          "ref": "skills/scripts/envctl/apply_profile.py",

          "role": "safe user-config actuator"

        },

        {

          "ref": "skills/catalog/external_adoption_reviews.json",

          "role": "adoption discipline"

        }

      ],

      "verification_gates": [

        "python -m skills.scripts.envctl validate governance",

        "python -m unittest discover -s skills/tests"